{
  "$schema": "https://json-schema.org/draft/2020-12/schema",
  "$id": "https://agentpass.dev/schema/intent-contract.schema.json",
  "title": "AgentPass Intent Contract",
  "type": "object",
  "additionalProperties": false,
  "required": [
    "schema_version",
    "intent_id",
    "profile",
    "issuer",
    "job_id",
    "required_outcomes",
    "hard_constraints",
    "issued_at"
  ],
  "properties": {
    "schema_version": { "const": "agentpass.intent-contract.v1" },
    "intent_id": { "type": "string", "minLength": 1 },
    "profile": { "type": "string", "minLength": 1 },
    "issuer": { "type": "string", "minLength": 1 },
    "job_id": { "type": "string", "minLength": 1 },
    "objective": { "type": "string", "minLength": 1 },
    "required_outcomes": {
      "type": "array",
      "minItems": 1,
      "items": { "$ref": "#/$defs/predicate" }
    },
    "hard_constraints": {
      "type": "array",
      "items": { "$ref": "#/$defs/predicate" }
    },
    "preferences": { "$ref": "#/$defs/preferences" },
    "evidence_requirements": {
      "type": "array",
      "uniqueItems": true,
      "items": { "$ref": "#/$defs/evidenceSource" }
    },
    "issued_at": { "type": "string", "format": "date-time" },
    "expires_at": { "type": "string", "format": "date-time" },
    "intent_digest": {
      "type": "string",
      "pattern": "^[a-f0-9]{64}$"
    }
  },
  "$defs": {
    "jsonValue": {
      "oneOf": [
        { "type": "null" },
        { "type": "boolean" },
        { "type": "number" },
        { "type": "string" },
        {
          "type": "array",
          "items": { "$ref": "#/$defs/jsonValue" }
        },
        {
          "type": "object",
          "additionalProperties": { "$ref": "#/$defs/jsonValue" }
        }
      ]
    },
    "evidenceSource": {
      "type": "string",
      "enum": ["decision_events", "execution_receipts", "observations", "job"]
    },
    "filter": {
      "type": "object",
      "additionalProperties": false,
      "required": ["path", "operator"],
      "properties": {
        "path": { "type": "string", "minLength": 1 },
        "operator": {
          "type": "string",
          "enum": ["equals", "not_equals", "in", "not_in", "exists"]
        },
        "value": { "$ref": "#/$defs/jsonValue" }
      }
    },
    "assertion": {
      "type": "object",
      "additionalProperties": false,
      "required": ["operator"],
      "properties": {
        "operator": {
          "type": "string",
          "enum": [
            "count_equals",
            "count_lte",
            "count_gte",
            "equals",
            "not_equals",
            "in",
            "not_in",
            "lte",
            "gte",
            "exists"
          ]
        },
        "path": { "type": "string", "minLength": 1 },
        "value": { "$ref": "#/$defs/jsonValue" },
        "quantifier": {
          "type": "string",
          "enum": ["any", "all"],
          "default": "any"
        }
      }
    },
    "predicate": {
      "type": "object",
      "additionalProperties": false,
      "required": ["id", "source", "assertion"],
      "properties": {
        "id": { "type": "string", "minLength": 1 },
        "description": { "type": "string" },
        "source": { "$ref": "#/$defs/evidenceSource" },
        "where": {
          "type": "array",
          "items": { "$ref": "#/$defs/filter" }
        },
        "assertion": { "$ref": "#/$defs/assertion" },
        "weight": { "type": "number", "exclusiveMinimum": 0, "default": 1 }
      }
    },
    "preferences": {
      "type": "object",
      "additionalProperties": false,
      "properties": {
        "max_tool_calls": { "type": "integer", "minimum": 0 },
        "max_execution_receipts": { "type": "integer", "minimum": 0 },
        "max_retries": { "type": "integer", "minimum": 0 },
        "max_replays": { "type": "integer", "minimum": 0 },
        "max_denied_decisions": { "type": "integer", "minimum": 0 },
        "max_runtime_ms": { "type": "number", "minimum": 0 },
        "max_estimated_cost_usd": { "type": "number", "minimum": 0 }
      }
    }
  }
}
