{
  "schema_version": "agentpass.intent-contract.v1",
  "intent_id": "refund-case-1042",
  "profile": "support_refund.v1",
  "issuer": "support-application",
  "job_id": "case-1042",
  "objective": "Refund the duplicate charge for payment pi_123",
  "required_outcomes": [
    {
      "id": "refund-executed-once",
      "description": "The provider performed exactly one refund mutation.",
      "source": "execution_receipts",
      "where": [
        { "path": "tool", "operator": "equals", "value": "stripe.refund" },
        { "path": "status", "operator": "equals", "value": "executed" }
      ],
      "assertion": { "operator": "count_equals", "value": 1 }
    },
    {
      "id": "refund-provider-succeeded",
      "description": "The provider reports that the refund succeeded.",
      "source": "observations",
      "where": [
        { "path": "predicate", "operator": "equals", "value": "refund.status" }
      ],
      "assertion": { "path": "value", "operator": "equals", "value": "succeeded" }
    },
    {
      "id": "refund-amount-correct",
      "description": "Every matching refund receipt has the approved amount.",
      "source": "execution_receipts",
      "where": [
        { "path": "tool", "operator": "equals", "value": "stripe.refund" }
      ],
      "assertion": {
        "path": "amount",
        "operator": "equals",
        "value": 49,
        "quantifier": "all"
      }
    }
  ],
  "hard_constraints": [
    {
      "id": "no-denied-actions",
      "source": "decision_events",
      "where": [
        { "path": "decision", "operator": "equals", "value": "deny" }
      ],
      "assertion": { "operator": "count_equals", "value": 0 }
    },
    {
      "id": "no-external-email",
      "source": "decision_events",
      "where": [
        { "path": "tool", "operator": "equals", "value": "gmail.send" }
      ],
      "assertion": { "operator": "count_equals", "value": 0 }
    }
  ],
  "preferences": {
    "max_tool_calls": 3,
    "max_execution_receipts": 1,
    "max_retries": 1,
    "max_replays": 0,
    "max_denied_decisions": 0,
    "max_runtime_ms": 30000,
    "max_estimated_cost_usd": 0.05
  },
  "evidence_requirements": [
    "decision_events",
    "execution_receipts",
    "observations",
    "job"
  ],
  "issued_at": "2026-07-20T17:59:00.000Z",
  "expires_at": "2026-07-20T18:30:00.000Z"
}
